{
  "review_version": "2.0",
  "work_id": "<work-id>",
  "pptx_sha256": "<current pptx sha256>",
  "contact_sheet_sha256": "<manifest.render.contact_sheet.sha256>",
  "page_sha256": {
    "1": "<manifest.render.pages[0].sha256>"
  },
  "page_count": 1,
  "verdict": "pass_with_issues",
  "blocker_count": 0,
  "severity_counts": {
    "critical": 0,
    "major": 0,
    "minor": 1
  },
  "overall_score": 7.8,
  "art_direction_alignment": {
    "overall": 8,
    "lost_intent": []
  },
  "slides": [
    {
      "slide": 1,
      "visual_structure": "editorial",
      "reference_ids": [
        "cover-editorial-contrast"
      ],
      "selected_candidate_id": "B",
      "scores": {
        "hierarchy": 8,
        "focal_point": 8,
        "composition": 7,
        "visual_interest": 8,
        "whitespace": 8
      },
      "art_direction_alignment": 8,
      "reference_intent_preserved": true,
      "ai_template_feel": "none",
      "issues": [
        {
          "code": "cover-caption-tight",
          "severity": "minor",
          "message": "封面副标题与页脚间距略紧"
        }
      ]
    }
  ],
  "deck": {
    "issues": []
  },
  "overall_summary": "<整体判断：这套版面可交付还是仍需返工，及理由>",
  "deck_rhythm": {
    "macro": "<全 deck 节奏判断>",
    "micro": "<页间衔接判断>"
  }
}
